{
  "acceptance_complete": true,
  "completion_report": {
    "changed_files": [],
    "commands": [
      "python scripts/check_self_improvement_traceability.py --manifest contracts/self-improvement-acceptance-traceability.yaml"
    ],
    "outcome": "All 18 self-improvement acceptance requirements are complete.",
    "profile_changes": [],
    "results": [
      "SI-AC-01: passed",
      "SI-AC-02: passed",
      "SI-AC-03: passed",
      "SI-AC-04: passed",
      "SI-AC-05: passed",
      "SI-AC-06: passed",
      "SI-AC-07: passed",
      "SI-AC-08: passed",
      "SI-AC-09: passed",
      "SI-AC-10: passed",
      "SI-AC-11: passed",
      "SI-AC-12: passed",
      "SI-AC-13: passed",
      "SI-AC-14: passed",
      "SI-AC-15: passed",
      "SI-AC-16: passed",
      "SI-AC-17: passed",
      "SI-AC-18: passed"
    ],
    "risks": [],
    "rollback": [
      "Delete the generated report; contracts and tests are read-only."
    ],
    "unverified": []
  },
  "generated_at": "2026-07-19T08:53:13.493886Z",
  "manifest_sha256": "a802db708a4addcd488ad0133faf4c978f83501fc8b4776d55f389a55100cb58",
  "report_version": 1,
  "requirements": [
    {
      "computed_status": "passed",
      "configured": true,
      "contracts": [
        {
          "path": "contracts/schemas/usage-config.schema.json",
          "reason": null,
          "sha256": "6dfef05222ec6be858a80543e65b739d2085ebb9273ff1561580415a3598300d",
          "status": "passed"
        }
      ],
      "declared_status": "passed",
      "enforced": true,
      "evidence": [
        {
          "kind": "automated-test",
          "path": "tests.test_usage_config.UsageConfigTests.test_status_is_read_only_and_defaults_to_disabled",
          "reason": null,
          "status": "passed"
        }
      ],
      "id": "SI-AC-01",
      "loaded": true,
      "passing": true,
      "phase": "P0",
      "reasons": [],
      "tests": [
        {
          "duration_ms": 8472,
          "exit_code": 0,
          "reason": null,
          "selector": "tests.test_usage_config.UsageConfigTests.test_status_is_read_only_and_defaults_to_disabled",
          "sha256": "232296722de3699dc7e3681a8e446f49cc1468ab84d64c79055f2df5286c4f9f",
          "status": "passed"
        }
      ]
    },
    {
      "computed_status": "passed",
      "configured": true,
      "contracts": [
        {
          "path": "contracts/schemas/usage-config.schema.json",
          "reason": null,
          "sha256": "6dfef05222ec6be858a80543e65b739d2085ebb9273ff1561580415a3598300d",
          "status": "passed"
        }
      ],
      "declared_status": "passed",
      "enforced": true,
      "evidence": [
        {
          "kind": "automated-test",
          "path": "tests.test_usage_config.UsageConfigTests.test_sync_authorization_is_separate_and_device_change_invalidates_it",
          "reason": null,
          "status": "passed"
        }
      ],
      "id": "SI-AC-02",
      "loaded": true,
      "passing": true,
      "phase": "P0",
      "reasons": [],
      "tests": [
        {
          "duration_ms": 8472,
          "exit_code": 0,
          "reason": null,
          "selector": "tests.test_usage_config.UsageConfigTests.test_sync_authorization_is_separate_and_device_change_invalidates_it",
          "sha256": "232296722de3699dc7e3681a8e446f49cc1468ab84d64c79055f2df5286c4f9f",
          "status": "passed"
        }
      ]
    },
    {
      "computed_status": "passed",
      "configured": true,
      "contracts": [
        {
          "path": "contracts/schemas/usage-event.schema.json",
          "reason": null,
          "sha256": "abbe87fdf5c0f6ebc63ec87b37d87ccb0ab7d2d13c4b9cb2a172bcb843267720",
          "status": "passed"
        }
      ],
      "declared_status": "passed",
      "enforced": true,
      "evidence": [
        {
          "kind": "automated-test",
          "path": "tests.test_usage_recording.UsageRecordingTests.test_record_writes_local_event_and_rebuilt_sanitized_outbound",
          "reason": null,
          "status": "passed"
        }
      ],
      "id": "SI-AC-03",
      "loaded": true,
      "passing": true,
      "phase": "P0",
      "reasons": [],
      "tests": [
        {
          "duration_ms": 8472,
          "exit_code": 0,
          "reason": null,
          "selector": "tests.test_usage_recording.UsageRecordingTests.test_record_writes_local_event_and_rebuilt_sanitized_outbound",
          "sha256": "d5ed107fa3a6121989f443d5853ee8d8ced42fe746ab6643455250ff0152de0d",
          "status": "passed"
        }
      ]
    },
    {
      "computed_status": "passed",
      "configured": true,
      "contracts": [
        {
          "path": "contracts/schemas/usage-event.schema.json#/$defs/sanitized_event",
          "reason": null,
          "sha256": "abbe87fdf5c0f6ebc63ec87b37d87ccb0ab7d2d13c4b9cb2a172bcb843267720",
          "status": "passed"
        }
      ],
      "declared_status": "passed",
      "enforced": true,
      "evidence": [
        {
          "kind": "automated-test",
          "path": "tests.test_usage_security.UsageSecurityTests.test_outbound_envelope_contains_only_digest_and_sanitized_payload",
          "reason": null,
          "status": "passed"
        }
      ],
      "id": "SI-AC-04",
      "loaded": true,
      "passing": true,
      "phase": "P0",
      "reasons": [],
      "tests": [
        {
          "duration_ms": 8472,
          "exit_code": 0,
          "reason": null,
          "selector": "tests.test_usage_security.UsageSecurityTests.test_outbound_envelope_contains_only_digest_and_sanitized_payload",
          "sha256": "630dbcd2765d5565b44e1aa5a51336a868d5e617abc207686ce1ab25440db034",
          "status": "passed"
        }
      ]
    },
    {
      "computed_status": "passed",
      "configured": true,
      "contracts": [
        {
          "path": "contracts/schemas/user-feedback.schema.json",
          "reason": null,
          "sha256": "be7f50e6452be29dc502752a063b9ef9fb4900e1e80001116d307357e1d8626f",
          "status": "passed"
        }
      ],
      "declared_status": "passed",
      "enforced": true,
      "evidence": [
        {
          "kind": "automated-test",
          "path": "tests.test_usage_recording.UsageRecordingTests.test_normal_success_samples_every_fifth_event_and_anomalies_always_ask",
          "reason": null,
          "status": "passed"
        }
      ],
      "id": "SI-AC-05",
      "loaded": true,
      "passing": true,
      "phase": "P0",
      "reasons": [],
      "tests": [
        {
          "duration_ms": 8472,
          "exit_code": 0,
          "reason": null,
          "selector": "tests.test_usage_recording.UsageRecordingTests.test_normal_success_samples_every_fifth_event_and_anomalies_always_ask",
          "sha256": "d5ed107fa3a6121989f443d5853ee8d8ced42fe746ab6643455250ff0152de0d",
          "status": "passed"
        }
      ]
    },
    {
      "computed_status": "passed",
      "configured": true,
      "contracts": [
        {
          "path": "contracts/schemas/usage-event.schema.json#/$defs/measurement",
          "reason": null,
          "sha256": "abbe87fdf5c0f6ebc63ec87b37d87ccb0ab7d2d13c4b9cb2a172bcb843267720",
          "status": "passed"
        }
      ],
      "declared_status": "passed",
      "enforced": true,
      "evidence": [
        {
          "kind": "automated-test",
          "path": "tests.test_usage_launcher.UsageLauncherTests.test_launcher_record_uses_bounded_report_facts_and_rejects_manual_spoofing",
          "reason": null,
          "status": "passed"
        }
      ],
      "id": "SI-AC-06",
      "loaded": true,
      "passing": true,
      "phase": "P1",
      "reasons": [],
      "tests": [
        {
          "duration_ms": 8472,
          "exit_code": 0,
          "reason": null,
          "selector": "tests.test_usage_launcher.UsageLauncherTests.test_launcher_record_uses_bounded_report_facts_and_rejects_manual_spoofing",
          "sha256": "0f5d13879362880e917c8b2aa8eaddaeb5ad138ae3883beb9403c6ea90fab900",
          "status": "passed"
        }
      ]
    },
    {
      "computed_status": "passed",
      "configured": true,
      "contracts": [
        {
          "path": "contracts/schemas/usage-config.schema.json",
          "reason": null,
          "sha256": "6dfef05222ec6be858a80543e65b739d2085ebb9273ff1561580415a3598300d",
          "status": "passed"
        }
      ],
      "declared_status": "passed",
      "enforced": true,
      "evidence": [
        {
          "kind": "automated-test",
          "path": "tests.test_usage_due.UsageDueTests.test_non_coordinator_is_blocked_without_creating_state",
          "reason": null,
          "status": "passed"
        }
      ],
      "id": "SI-AC-07",
      "loaded": true,
      "passing": true,
      "phase": "P0",
      "reasons": [],
      "tests": [
        {
          "duration_ms": 8472,
          "exit_code": 0,
          "reason": null,
          "selector": "tests.test_usage_due.UsageDueTests.test_non_coordinator_is_blocked_without_creating_state",
          "sha256": "0fcd175f5525f8ae025f953da145d4b9af9add8fd37a8d439e8f02e8ee345055",
          "status": "passed"
        }
      ]
    },
    {
      "computed_status": "passed",
      "configured": true,
      "contracts": [
        {
          "path": "contracts/openapi-engineering.openapi.yaml#/paths/~1v1~1usage~1synchronizations",
          "reason": null,
          "sha256": "bb87c7c479ce9836e28db99b0592a2d5d1b59254731c37327d46e762ee4bb6cd",
          "status": "passed"
        }
      ],
      "declared_status": "passed",
      "enforced": true,
      "evidence": [
        {
          "kind": "automated-test",
          "path": "tests.test_usage_git_sync.UsageGitSyncTests.test_remote_failure_never_drops_outbound",
          "reason": null,
          "status": "passed"
        }
      ],
      "id": "SI-AC-08",
      "loaded": true,
      "passing": true,
      "phase": "P0",
      "reasons": [],